ReviewID,CustomerID,ProductID,ReviewText,ReviewDate,ReviewSentiment,SentimentClass
1,486,267,So impressed by the quality. This product truly delivers.,2024-05-12,1.0,Positive
2,810,246,I'm very happy with the performance. It does exactly what I need.,2024-03-07,0.625,Positive
3,855,291,I regret buying this. The quality is terrible and it stopped working within a week.,2023-11-15,-1.0,Negative
4,524,235,"It serves its purpose, but it's not anything extraordinary.",2024-05-27,0.3333333333333333,Positive
5,238,220,Very high-quality product. I would buy it again without hesitation.,2023-09-10,0.2,Positive
6,578,263,It's neither great nor terrible. It's just okay.,2024-04-14,0.10000000000000002,Positive
7,181,261,Everything about this product is great! It works as advertised and more.,2023-12-23,0.75,Positive
8,262,215,This is the worst product I've bought in a long time. It doesn't do what it's supposed to.,2023-12-16,-0.525,Negative
9,362,222,I've had nothing but problems with this product. It's not reliable.,2023-09-21,0.0,Neutral
10,563,204,Perfect product for my needs! I can't imagine using anything else now.,2023-07-20,1.0,Positive
11,315,260,I'm extremely disappointed with this product. It doesn't work as promised.,2023-12-10,-0.75,Negative
12,651,276,"The product is awful. It doesn't work as it should, and it's frustrating to use.",2023-10-01,-0.7,Negative
13,863,220,It's an okay option if you're looking for something basic.,2024-01-23,0.25,Positive
14,648,233,"It's functional, but I'm not blown away by it.",2024-03-28,0.0,Neutral
15,682,291,"It's decent, though I expected a little more.",2024-01-12,0.09479166666666666,Positive
16,691,299,"I've used it for a week, and it functions as advertised, but it's not extraordinary.",2023-11-25,-0.16666666666666666,Negative
17,284,245,This is hands down the best purchase I've made this year.,2023-08-19,0.4222222222222222,Positive
18,828,249,I am extremely satisfied with my purchase. Worth every penny!,2023-09-20,0.4375,Positive
19,622,280,I couldn't be more pleased with this purchase. It works perfectly!,2023-10-27,0.6666666666666666,Positive
20,178,201,I've been using it for a while now and it's performing perfectly.,2024-01-25,1.0,Positive
21,506,288,Absolutely love this product! It's a game-changer.,2024-03-28,0.625,Positive
22,197,240,"It's a decent option, but not the best one out there.",2023-10-15,0.5833333333333334,Positive
23,677,258,The product is of poor quality. It doesn't last long and doesn't do what it should.,2023-08-25,-0.15,Negative
24,346,283,The product is exactly what I was hoping for. I'm very satisfied.,2023-12-27,0.45,Positive
25,564,246,Worth every penny! Amazing quality and service.,2023-07-30,0.48750000000000004,Positive
26,820,213,"It does the job, but I wasn't impressed by its performance.",2023-07-14,1.0,Positive
27,541,205,"The product works, but I've had better experiences with similar products.",2024-03-13,0.25,Positive
28,153,204,Absolutely love this product! It's a game-changer.,2023-10-24,0.625,Positive
29,982,210,I absolutely love this product! It exceeded my expectations in every way.,2023-12-15,0.625,Positive
30,945,268,This product has made my daily routine so much easier. Highly recommend.,2024-01-26,0.12,Positive
31,386,279,This product is cheaply made and didn't meet my expectations at all.,2024-01-11,0.4,Positive
32,661,261,The product functions as expected but isn't remarkable.,2024-05-11,0.325,Positive
33,396,298,"It's an okay product, but there are some issues I have with it.",2023-12-12,0.5,Positive
34,931,297,This product has saved me so much time and effort. I couldn't be happier.,2024-01-07,0.2,Positive
35,856,229,I couldn't be more pleased with this purchase. It works perfectly!,2023-07-04,0.6666666666666666,Positive
36,464,292,This product does exactly what I wanted it to do. Very pleased.,2024-02-28,0.45,Positive
37,307,264,I'm very pleased with how quickly it arrived and the quality of the product.,2023-08-26,0.4916666666666667,Positive
38,344,240,"It's a decent product, but it doesn't offer the best value for the price.",2024-05-11,0.5833333333333334,Positive
39,367,202,This product does exactly what I wanted it to do. Very pleased.,2024-02-04,0.45,Positive
40,206,264,This has been one of the best purchases I've made. Highly recommended!,2024-05-06,0.6,Positive
41,551,261,This product is a game-changer. I'm so glad I bought it.,2023-08-24,0.5,Positive
42,780,269,I've had nothing but problems with this product. It's not reliable.,2023-09-19,0.0,Neutral
43,251,270,I've never been this satisfied with a purchase before.,2023-10-21,0.5,Positive
44,450,242,"This item is exactly as described, and it works beautifully!",2024-03-13,0.625,Positive
45,251,245,I regret buying this. The quality is terrible and it stopped working within a week.,2023-10-01,-1.0,Negative
46,550,230,Such a fantastic product at a great price. Worth every cent!,2023-12-06,0.39375000000000004,Positive
47,235,206,The quality and performance of this product are top-notch.,2023-06-30,1.0,Positive
48,729,219,"I tried using it, but it's just not functional. Very frustrating.",2024-03-01,-0.52,Negative
49,822,204,"It's a basic product. Works, but no wow factor.",2024-01-27,-0.025,Neutral
50,426,279,"It's functional, but I'm not convinced it's the best choice for this price.",2024-01-24,1.0,Positive
51,794,206,I tried it once and it didn't work at all. Wouldn't recommend to anyone.,2024-01-31,0.0,Neutral
52,832,215,The product functions as expected but isn't remarkable.,2024-05-18,0.325,Positive
53,740,203,"I'm so dissatisfied. It doesn't work, and the build quality is subpar.",2024-04-12,0.0,Neutral
54,510,225,"This didn't work as expected, and I'm very disappointed with my purchase.",2023-12-26,-0.5375000000000001,Negative
55,306,270,It was a complete waste of money. I would never buy this again.,2024-01-01,-0.05,Neutral
56,950,241,"I've used it for a week, and it functions as advertised, but it's not extraordinary.",2023-07-23,-0.16666666666666666,Negative
57,102,201,Very poor quality. It's already falling apart after a few weeks of use.,2023-11-20,-0.36,Negative
58,560,235,"The customer service was fantastic, and the product arrived on time.",2023-10-08,0.4,Positive
59,417,237,"Fantastic quality, and the performance is just amazing. Highly recommend!",2024-01-05,0.39999999999999997,Positive
60,590,201,"The product is fine, but it lacks the features I was hoping for.",2023-12-21,0.4166666666666667,Positive
61,225,247,"The product is fine, but it lacks the features I was hoping for.",2024-03-21,0.4166666666666667,Positive
62,993,239,Impressed with the durability and performance of this product.,2023-08-07,1.0,Positive
63,317,207,"It works so well, and it's exactly what I needed for my project.",2023-12-28,0.25,Positive
64,828,238,"It works fine, but I had expected a bit more for the price.",2023-10-01,0.2722222222222222,Positive
65,700,249,Wonderful product! The quality and performance are unmatched.,2024-03-25,1.0,Positive
66,306,231,I've had a wonderful experience with this product. Definitely recommend it!,2024-03-07,0.5,Positive
67,161,226,I couldn't be happier with my purchase. It's perfect for what I needed.,2023-08-23,1.0,Positive
68,230,281,This product didn't live up to its promises. I'm very disappointed.,2023-11-07,-0.41931818181818187,Negative
69,957,258,"Perfect fit, great design, and works like a charm. Very pleased!",2024-03-28,0.753125,Positive
70,107,278,This product is decent but doesn't stand out in any way.,2024-04-20,0.16666666666666666,Positive
71,688,248,I'm very unhappy with this purchase. It didn't meet my expectations.,2024-06-17,-0.78,Negative
72,681,221,Works perfectly! Totally exceeded my expectations in terms of performance.,2024-03-08,0.0,Neutral
73,307,214,Great product and excellent customer support. Totally worth it!,2023-08-08,0.725,Positive
74,596,240,"I love this item. It's sturdy, functional, and well-made.",2024-04-10,0.5,Positive
75,708,224,"It's an okay product, but there are some issues I have with it.",2023-07-10,0.5,Positive
76,785,204,Very sleek design and works just as advertised. Love it!,2024-06-02,0.4125,Positive
77,756,229,The product is exactly what I was hoping for. I'm very satisfied.,2023-09-15,0.45,Positive
78,666,283,The quality and performance of this product are top-notch.,2023-08-14,1.0,Positive
79,193,231,This product didn't work as expected. It's unreliable and frustrating.,2024-03-31,-0.25,Negative
80,229,225,I absolutely love this! It's even better than I expected.,2023-06-28,0.3416666666666666,Positive
81,747,242,Top-notch customer service and a reliable product. Great job!,2024-05-17,1.0,Positive
82,129,251,I'm amazed by how well it works. Great value for the price!,2023-07-26,1.0,Positive
83,141,272,"Not good at all. The quality is very poor, and I'm disappointed.",2023-09-09,-0.54,Negative
84,898,281,"It works fine for now, but I'm not sure about its long-term durability.",2023-10-20,0.08333333333333334,Positive
85,100,220,I've had a wonderful experience with this product. Definitely recommend it!,2024-04-14,0.5,Positive
86,508,206,"I have mixed feelings. It's fine, but I was expecting a bit more.",2023-12-27,0.3055555555555556,Positive
87,992,200,I regret buying this. The product is ineffective and badly made.,2023-10-05,-0.6999999999999998,Negative
88,744,275,Worth every penny! Amazing quality and service.,2024-05-11,0.48750000000000004,Positive
89,187,284,"The quality is average, and it's okay for the price.",2023-08-28,0.175,Positive
90,983,243,Great performance and easy to use. I'm very satisfied with this product.,2024-03-23,0.6277777777777778,Positive
91,571,206,I've never been this satisfied with a purchase before.,2024-06-08,0.5,Positive
92,474,278,Very high-quality product. I would buy it again without hesitation.,2023-12-22,0.2,Positive
93,739,248,This product didn't live up to its promises. I'm very disappointed.,2024-01-20,-0.41931818181818187,Negative
94,949,267,Extremely dissatisfied. The product broke down after just one use.,2024-01-12,-0.14027777777777778,Negative
95,992,229,Best investment I've made in a long time. Very happy with my purchase.,2024-06-08,0.65,Positive
96,256,222,Perfect product for my needs! I can't imagine using anything else now.,2023-07-12,1.0,Positive
97,952,270,"Great design, easy to use, and it works wonderfully. Highly recommend!",2024-04-07,0.4777777777777778,Positive
98,847,296,"It's a decent product, but it doesn't offer the best value for the price.",2023-09-26,0.5833333333333334,Positive
99,808,284,This product has exceeded all my expectations. Very satisfied.,2024-06-07,0.65,Positive
100,843,296,"The customer service was fantastic, and the product arrived on time.",2023-12-15,0.4,Positive
101,470,258,"It does the job, but I wasn't impressed by its performance.",2024-05-05,1.0,Positive
102,194,292,This product does exactly what I wanted it to do. Very pleased.,2024-05-02,0.45,Positive
103,289,209,Impressed with the durability and performance of this product.,2024-04-03,1.0,Positive
104,366,246,"The product is decent, but I've come across better quality.",2024-02-16,0.3333333333333333,Positive
105,302,235,Everything about this product is great! It works as advertised and more.,2023-07-22,0.75,Positive
106,591,205,Works perfectly! Totally exceeded my expectations in terms of performance.,2024-03-19,0.0,Neutral
107,967,254,I'm very pleased with how quickly it arrived and the quality of the product.,2024-01-21,0.4916666666666667,Positive
108,419,239,"I've been using this for a few weeks now, and it works flawlessly.",2023-08-22,0.4,Positive
109,572,278,This has been one of the best purchases I've made. Highly recommended!,2023-07-25,0.6,Positive
110,130,283,"It's okay for basic use, but I wouldn't recommend it for anything more.",2023-12-20,0.3333333333333333,Positive
111,169,204,This product is decent but doesn't stand out in any way.,2024-01-12,0.16666666666666666,Positive
112,791,244,The product is exactly what I was hoping for. I'm very satisfied.,2023-12-13,0.45,Positive
113,963,296,Everything about this product is perfect. So happy with it!,2024-04-12,1.0,Positive
114,283,279,This has been one of the best purchases I've made. Highly recommended!,2023-08-16,0.6,Positive
115,253,245,"The product arrived on time, and I couldn't be happier with it.",2024-05-31,0.0,Neutral
116,383,260,The quality is outstanding. I'm extremely impressed.,2024-03-11,0.75,Positive
117,676,225,I absolutely love this product! It exceeded my expectations in every way.,2024-06-17,0.625,Positive
118,615,225,I regret buying this. The quality is terrible and it stopped working within a week.,2023-10-08,-1.0,Negative
119,434,253,"Excellent quality, great design, and super easy to use.",2024-03-16,0.6416666666666666,Positive
120,433,212,"It's decent for the price, but it's not high quality.",2024-02-15,0.04333333333333333,Neutral
121,316,279,I'm amazed by how well it works. Great value for the price!,2024-03-14,1.0,Positive
122,529,221,I regret buying this. The quality is terrible and it stopped working within a week.,2024-04-13,-1.0,Negative
123,574,234,Worth every penny! Amazing quality and service.,2024-04-17,0.48750000000000004,Positive
124,795,261,"It works as advertised, but it's not particularly impressive.",2023-10-31,-0.5,Negative
125,235,222,"The product does its job, but I expected something more impressive.",2024-04-24,0.4666666666666666,Positive
126,503,273,It's sufficient for basic needs but could be better.,2023-09-01,0.25,Positive
127,185,295,"It's not great, but it's not bad either. It's somewhere in between.",2024-05-30,-0.02500000000000005,Neutral
128,120,210,The product is exactly what I was hoping for. I'm very satisfied.,2024-06-25,0.45,Positive
129,759,263,Worth every penny! Amazing quality and service.,2023-08-23,0.48750000000000004,Positive
130,150,249,Wonderful product! The quality and performance are unmatched.,2023-10-02,1.0,Positive
131,465,217,The product is exactly what I was hoping for. I'm very satisfied.,2024-03-15,0.45,Positive
132,898,295,"It serves its purpose, but it's not anything extraordinary.",2023-12-16,0.3333333333333333,Positive
133,137,238,I can't believe I wasted my money on this. It's not worth it.,2023-07-07,-0.175,Negative
134,571,220,"Fantastic quality, and the performance is just amazing. Highly recommend!",2024-05-16,0.39999999999999997,Positive
135,355,241,"The product is good for the price, but there are some minor flaws.",2023-07-21,0.32499999999999996,Positive
136,560,293,I was expecting more from this product. It doesn't perform well.,2023-09-26,0.5,Positive
137,349,247,Great performance and easy to use. I'm very satisfied with this product.,2023-07-15,0.6277777777777778,Positive
138,317,294,"Fantastic quality, and the performance is just amazing. Highly recommend!",2023-10-11,0.39999999999999997,Positive
139,375,251,"I'm satisfied, but I'm not overly enthusiastic about this product.",2023-10-06,0.55,Positive
140,242,250,"The product is okay, just nothing special to make it stand out.",2023-09-11,0.4285714285714286,Positive
141,281,266,"This item is exactly as described, and it works beautifully!",2023-08-02,0.625,Positive
142,804,215,"Not good at all. The quality is very poor, and I'm disappointed.",2024-06-01,-0.54,Negative
143,723,271,Best investment I've made in a long time. Very happy with my purchase.,2023-10-01,0.65,Positive
144,141,262,I'm very happy with the performance. It does exactly what I need.,2023-10-15,0.625,Positive
145,492,292,I absolutely love this! It's even better than I expected.,2024-06-03,0.3416666666666666,Positive
146,261,225,I'm very happy with the performance. It does exactly what I need.,2023-10-18,0.625,Positive
147,317,230,Top-notch customer service and a reliable product. Great job!,2023-09-14,1.0,Positive
148,487,262,The product does not match the description. Avoid this seller.,2024-02-24,0.0,Neutral
149,907,275,"It's a standard product, nothing to rave about.",2023-07-21,0.0,Neutral
150,566,218,"I tried using it, but it's just not functional. Very frustrating.",2024-01-21,-0.52,Negative
151,312,282,The best product I've used in a long time. Kudos to the team!,2023-08-08,0.46875,Positive
152,161,216,"It's okay for basic use, but I wouldn't recommend it for anything more.",2023-07-09,0.3333333333333333,Positive
153,616,226,Top-notch customer service and a reliable product. Great job!,2024-03-14,1.0,Positive
154,843,207,I am extremely satisfied with my purchase. Worth every penny!,2024-01-26,0.4375,Positive
155,564,279,I absolutely love this product! It exceeded my expectations in every way.,2024-02-20,0.625,Positive
156,715,216,I'm really impressed with the quality and the results. 10/10!,2024-02-02,1.0,Positive
157,875,253,Best investment I've made in a long time. Very happy with my purchase.,2024-01-19,0.65,Positive
158,331,224,Perfect product for my needs! I can't imagine using anything else now.,2023-11-06,1.0,Positive
159,493,287,The product is okay but nothing too special.,2023-07-13,0.4285714285714286,Positive
160,673,238,"It's not bad, but I wouldn't say it's great either.",2023-10-04,0.575,Positive
161,939,299,The item I received was completely different from what was shown online.,2024-01-18,0.0,Neutral
162,168,285,"It works so well, and it's exactly what I needed for my project.",2024-01-28,0.25,Positive
163,653,231,"It's a standard product, nothing to rave about.",2024-06-11,0.0,Neutral
164,266,223,Such a fantastic product at a great price. Worth every cent!,2023-11-20,0.39375000000000004,Positive
165,929,274,Overpriced for what it offers. Very unhappy with my purchase.,2024-02-07,-0.34,Negative
166,889,270,"It's fine for casual use, but I wouldn't use it for anything heavy.",2023-10-18,-0.09444444444444444,Negative
167,119,269,"It serves its purpose, but it's not anything extraordinary.",2024-06-08,0.3333333333333333,Positive
168,488,235,"The product didn't last long, and the performance was very underwhelming.",2023-10-09,0.05000000000000001,Positive
169,881,252,"The product is good for the price, but there are some minor flaws.",2024-05-11,0.32499999999999996,Positive
170,261,246,"I've been using this for a few weeks now, and it works flawlessly.",2024-01-20,0.4,Positive
171,456,230,I've never been this satisfied with a purchase before.,2024-03-07,0.5,Positive
172,690,273,I'm amazed by how well it works. Great value for the price!,2024-06-09,1.0,Positive
173,804,239,Works perfectly! Totally exceeded my expectations in terms of performance.,2023-10-21,0.0,Neutral
174,281,222,"I've used it for a week, and it functions as advertised, but it's not extraordinary.",2024-05-17,-0.16666666666666666,Negative
175,914,217,"I've used it a few times and it works, but it's not impressive.",2023-07-13,-0.35,Negative
176,945,259,The best product I've used in a long time. Kudos to the team!,2023-12-25,0.46875,Positive
177,554,218,"It's good enough to keep, but I'm not excited about it.",2023-06-30,0.1708333333333333,Positive
178,650,247,I've had a wonderful experience with this product. Definitely recommend it!,2024-04-08,0.5,Positive
179,567,224,"The product is decent, but I've come across better quality.",2023-11-25,0.3333333333333333,Positive
180,848,279,This product didn't live up to its promises. I'm very disappointed.,2023-12-27,-0.41931818181818187,Negative
181,427,258,Everything about this product is great! It works as advertised and more.,2024-04-19,0.75,Positive
182,514,299,"It works, but it doesn't feel like a high-end product.",2024-06-08,0.0,Neutral
183,315,242,Very sleek design and works just as advertised. Love it!,2024-05-21,0.4125,Positive
184,417,287,This product didn't live up to its promises. I'm very disappointed.,2023-07-02,-0.41931818181818187,Negative
185,325,283,This product does exactly what I wanted it to do. Very pleased.,2024-04-21,0.45,Positive
186,308,223,The quality is outstanding. I'm extremely impressed.,2024-02-08,0.75,Positive
187,160,260,The quality is outstanding. I'm extremely impressed.,2024-06-15,0.75,Positive
188,629,262,Great product and excellent customer support. Totally worth it!,2024-03-08,0.725,Positive
189,569,257,Impressed with the durability and performance of this product.,2023-12-03,1.0,Positive
190,691,216,It was a complete waste of money. I would never buy this again.,2023-10-23,-0.05,Neutral
191,153,214,"Very poor product. It broke down after minimal use, and I'm not happy.",2023-11-18,-0.29388888888888887,Negative
192,423,284,Perfect product for my needs! I can't imagine using anything else now.,2023-08-21,1.0,Positive
193,599,250,"Great design, easy to use, and it works wonderfully. Highly recommend!",2023-09-02,0.4777777777777778,Positive
194,941,275,Worth every penny! Amazing quality and service.,2024-02-21,0.48750000000000004,Positive
195,891,274,Very disappointed with my purchase. The product is useless.,2024-05-08,-0.7375,Negative
196,718,294,It's easy to use and super efficient. I'm so glad I bought it.,2023-09-10,0.4222222222222222,Positive
197,555,226,"It's a decent option, but not the best one out there.",2024-03-25,0.5833333333333334,Positive
198,415,289,"It works so well, and it's exactly what I needed for my project.",2023-07-18,0.25,Positive
199,860,236,Everything about this product is perfect. So happy with it!,2024-05-03,1.0,Positive
200,963,273,Everything about this product is great! It works as advertised and more.,2023-08-27,0.75,Positive
201,370,208,Not worth the investment. Very disappointing experience.,2024-01-05,-0.465,Negative
202,544,265,This is exactly what I was looking for. I'm so glad I bought it!,2024-06-24,0.4375,Positive
203,261,252,I was expecting more from this product. It doesn't perform well.,2024-01-30,0.5,Positive
204,491,223,Excellent quality and fast shipping. Very happy with it.,2024-04-14,0.7333333333333334,Positive
205,847,286,"I love this item. It's sturdy, functional, and well-made.",2024-01-31,0.5,Positive
206,312,200,Great product and excellent customer support. Totally worth it!,2023-07-18,0.725,Positive
207,446,238,Very high-quality product. I would buy it again without hesitation.,2024-05-01,0.2,Positive
208,644,208,I couldn't be more pleased with this purchase. It works perfectly!,2024-03-10,0.6666666666666666,Positive
209,538,265,The quality is outstanding. I'm extremely impressed.,2024-04-12,0.75,Positive
210,684,288,"It's neither good nor bad. It works, but nothing to rave about.",2024-05-21,5.551115123125783e-17,Neutral
211,949,253,"It's an okay product, but there are some issues I have with it.",2023-08-04,0.5,Positive
212,687,231,I'm very happy with the performance. It does exactly what I need.,2023-12-03,0.625,Positive
213,576,282,"The product functions well, but I feel it could be improved in some areas.",2024-06-16,0.0,Neutral
214,237,201,"I tried to get support, but they never helped. The product is just bad.",2024-01-19,-0.6999999999999998,Negative
215,703,245,"It's a decent product, but it doesn't offer the best value for the price.",2024-02-21,0.5833333333333334,Positive
216,568,271,"It's an okay product, but there are some issues I have with it.",2023-07-04,0.5,Positive
217,801,201,"The customer service was fantastic, and the product arrived on time.",2023-11-29,0.4,Positive
218,392,234,It's easy to use and super efficient. I'm so glad I bought it.,2023-08-03,0.4222222222222222,Positive
219,395,260,"It serves its purpose, but it's not anything extraordinary.",2023-10-10,0.3333333333333333,Positive
220,288,231,Works perfectly! Totally exceeded my expectations in terms of performance.,2024-06-24,0.0,Neutral
221,240,206,"The product arrived on time, and I couldn't be happier with it.",2023-08-16,0.0,Neutral
222,585,217,I've had a wonderful experience with this product. Definitely recommend it!,2023-11-26,0.5,Positive
223,968,225,"It works fine for what it's meant to do, but there's nothing exciting about it.",2023-10-22,0.35833333333333334,Positive
224,226,214,I've had a wonderful experience with this product. Definitely recommend it!,2023-10-19,0.5,Positive
225,182,238,"I was expecting something better, but this product is just average.",2023-12-17,0.175,Positive
226,308,255,"The customer service was fantastic, and the product arrived on time.",2024-04-03,0.4,Positive
227,714,285,This product has exceeded all my expectations. I'm thrilled with it.,2023-12-19,0.6,Positive
228,160,249,The product is just fine. Doesn't stand out in any way.,2023-11-24,0.4166666666666667,Positive
229,219,265,"I have no complaints, but I don't have any praise for it either.",2023-08-18,0.0,Neutral
230,328,249,"The product arrived on time, but it's just alright.",2023-09-18,0.0,Neutral
231,503,214,This product is absolutely amazing. I'm recommending it to all my friends.,2024-03-25,0.6000000000000001,Positive
232,239,298,This has been one of the best purchases I've made. Highly recommended!,2023-07-09,0.6,Positive
233,901,291,Great performance and easy to use. I'm very satisfied with this product.,2024-06-19,0.6277777777777778,Positive
234,606,256,I am extremely satisfied with my purchase. Worth every penny!,2023-07-30,0.4375,Positive
235,727,252,"It's not bad, just didn't live up to the expectations I had.",2023-11-13,0.24318181818181814,Positive
236,493,283,The quality is outstanding. I'm extremely impressed.,2023-09-19,0.75,Positive
237,560,226,I've been using it for a while now and it's performing perfectly.,2023-07-26,1.0,Positive
238,380,253,This product has exceeded all my expectations. I'm thrilled with it.,2023-12-07,0.6,Positive
239,300,280,Not worth the investment. Very disappointing experience.,2023-08-16,-0.465,Negative
240,703,222,This is exactly what I was looking for. I'm so glad I bought it!,2024-01-13,0.4375,Positive
