ReviewID,CustomerID,ProductID,ReviewText,ReviewDate,ReviewSentiment,SentimentClass
722,470,237,Not worth the hype. It's poorly made and doesn't function well.,2024-01-30,-0.275,Negative
723,436,250,Great product and excellent customer support. Totally worth it!,2023-07-09,0.725,Positive
724,430,271,"It's acceptable, but I don't have any strong feelings about it.",2024-04-07,0.43333333333333335,Positive
725,241,279,"It works so well, and it's exactly what I needed for my project.",2024-05-13,0.25,Positive
726,681,225,"Not bad, but there's room for improvement in some areas.",2024-02-23,0.3499999999999999,Positive
727,469,204,Worth every penny! Amazing quality and service.,2024-02-21,0.48750000000000004,Positive
728,499,277,This doesn't even deserve one star. Completely useless and unreliable.,2024-02-04,-0.5,Negative
729,713,291,"The product is fine, but it lacks the features I was hoping for.",2024-03-16,0.4166666666666667,Positive
730,391,201,"Customer service was unhelpful, and the product is subpar.",2023-07-15,0.0,Neutral
731,700,267,I'm amazed by how well it works. Great value for the price!,2023-08-30,1.0,Positive
732,952,216,"Fantastic quality, and the performance is just amazing. Highly recommend!",2024-02-06,0.39999999999999997,Positive
733,672,248,This product has exceeded all my expectations. Very satisfied.,2023-09-05,0.65,Positive
734,234,280,The quality and performance of this product are top-notch.,2023-11-18,1.0,Positive
735,964,231,I'm really impressed with the quality and the results. 10/10!,2023-12-21,1.0,Positive
736,603,221,The product does exactly what it's supposed to do. Very happy.,2024-02-10,0.625,Positive
737,303,252,"It's okay overall, but I expected a bit more based on the reviews.",2023-12-07,0.225,Positive
738,297,296,This product has made my daily routine so much easier. Highly recommend.,2023-06-26,0.12,Positive
739,812,214,"It didn't work from the start, and I'm very upset with the quality.",2023-08-04,0.2,Positive
740,285,299,I'm really impressed with the quality and the results. 10/10!,2024-04-04,1.0,Positive
741,837,289,"It broke within a few days of use, and customer service didn't help at all.",2023-08-14,-0.2,Negative
742,569,229,"The quality is fine, but I've seen better products at this price.",2024-05-27,0.45833333333333337,Positive
743,972,264,I don't recommend this at all. It's not functional and doesn't last.,2023-10-16,0.0,Neutral
744,199,260,"I have mixed feelings. It's fine, but I was expecting a bit more.",2024-04-09,0.3055555555555556,Positive
745,487,263,This product has exceeded all my expectations. I'm thrilled with it.,2024-02-25,0.6,Positive
746,645,280,I tried it once and it didn't work at all. Wouldn't recommend to anyone.,2024-06-21,0.0,Neutral
747,611,256,The product does exactly what it's supposed to do. Very happy.,2023-09-06,0.625,Positive
748,741,282,"It's functional, but I don't feel strongly about it either way.",2024-02-29,0.43333333333333335,Positive
749,666,200,"The quality is fine, but I've seen better products at this price.",2023-10-09,0.45833333333333337,Positive
750,729,257,Very high-quality product. I would buy it again without hesitation.,2023-12-06,0.2,Positive
751,832,292,This is exactly what I was looking for. I'm so glad I bought it!,2024-01-16,0.4375,Positive
752,763,280,The item broke after a few days of use. Not happy at all.,2023-09-29,-0.30000000000000004,Negative
753,486,248,This product is absolutely amazing. I'm recommending it to all my friends.,2024-03-05,0.6000000000000001,Positive
754,744,235,I'm really impressed with the quality and the results. 10/10!,2023-09-16,1.0,Positive
755,683,238,The quality and performance of this product are top-notch.,2024-01-25,1.0,Positive
756,380,250,I'm very happy with the performance. It does exactly what I need.,2023-11-26,0.625,Positive
757,123,200,I regret buying this. The product is ineffective and badly made.,2024-03-03,-0.6999999999999998,Negative
758,700,220,This product is terrible. It broke after the second use and didn't perform as expected.,2024-04-01,-0.3666666666666667,Negative
759,470,252,This product has exceeded all my expectations. I'm thrilled with it.,2024-01-31,0.6,Positive
760,280,283,This is the worst item I've ever bought. I wish I could return it.,2024-02-25,-1.0,Negative
761,966,291,"This item is exactly as described, and it works beautifully!",2023-11-04,0.625,Positive
762,570,298,Wonderful product! The quality and performance are unmatched.,2024-03-28,1.0,Positive
763,684,280,"It's acceptable, but I don't have any strong feelings about it.",2024-02-26,0.43333333333333335,Positive
764,336,283,Very high-quality product. I would buy it again without hesitation.,2023-09-26,0.2,Positive
765,734,229,I couldn't be happier with my purchase. It's perfect for what I needed.,2023-08-07,1.0,Positive
766,187,271,Impressed with the durability and performance of this product.,2024-01-16,1.0,Positive
767,771,261,"It works fine, but I had expected a bit more for the price.",2023-08-19,0.2722222222222222,Positive
768,616,298,"It's okay overall, but I expected a bit more based on the reviews.",2024-01-05,0.225,Positive
769,434,246,This has been one of the best purchases I've made. Highly recommended!,2024-05-10,0.6,Positive
770,551,258,I couldn't be more pleased with this purchase. It works perfectly!,2023-12-10,0.6666666666666666,Positive
771,254,251,This has been one of the best purchases I've made. Highly recommended!,2024-04-07,0.6,Positive
772,669,282,This is one of the best products I've bought in a long time.,2023-09-21,0.475,Positive
773,460,296,Impressed with the durability and performance of this product.,2024-04-17,1.0,Positive
774,591,253,"The product arrived on time, but it's just alright.",2023-07-25,0.0,Neutral
775,954,291,I absolutely love this! It's even better than I expected.,2024-04-13,0.3416666666666666,Positive
776,232,263,"I love this item. It's sturdy, functional, and well-made.",2023-08-20,0.5,Positive
777,804,225,"It's fine for casual use, but I wouldn't use it for anything heavy.",2023-07-25,-0.09444444444444444,Negative
778,365,257,Impressed with the durability and performance of this product.,2023-07-22,1.0,Positive
779,203,221,I regret buying this. The product is ineffective and badly made.,2023-12-10,-0.6999999999999998,Negative
780,302,210,"It's functional, but I don't feel strongly about it either way.",2024-06-25,0.43333333333333335,Positive
781,803,299,This product is absolutely amazing. I'm recommending it to all my friends.,2023-10-02,0.6000000000000001,Positive
782,972,236,This product is absolutely amazing. I'm recommending it to all my friends.,2024-01-11,0.6000000000000001,Positive
783,409,258,"It's functional, but I don't feel strongly about it either way.",2023-08-04,0.43333333333333335,Positive
784,622,232,"The quality is fine, but I've seen better products at this price.",2024-03-20,0.45833333333333337,Positive
785,594,213,"I can't say it's amazing, but it does what I need it to do.",2023-09-17,0.6000000000000001,Positive
786,910,211,"It's a decent product for the price, though there are better alternatives.",2024-03-02,0.3333333333333333,Positive
787,429,279,The product does exactly what it's supposed to do. Very happy.,2024-02-07,0.625,Positive
788,703,242,This is one of the best products I've bought in a long time.,2024-02-26,0.475,Positive
789,170,298,Top-notch customer service and a reliable product. Great job!,2023-07-15,1.0,Positive
790,564,208,"It's not great, but it's not bad either. It's somewhere in between.",2024-03-31,-0.02500000000000005,Neutral
791,218,214,"It works so well, and it's exactly what I needed for my project.",2023-09-12,0.25,Positive
792,792,242,Worth every penny! Amazing quality and service.,2024-01-04,0.48750000000000004,Positive
793,628,258,"It's a basic product. Works, but no wow factor.",2023-11-15,-0.025,Neutral
794,655,289,"I love this item. It's sturdy, functional, and well-made.",2023-11-05,0.5,Positive
795,488,295,"I was hoping for something better, but this item is completely useless.",2023-11-13,0.0,Neutral
796,681,279,Works perfectly! Totally exceeded my expectations in terms of performance.,2024-02-28,0.0,Neutral
797,929,267,"It works fine, but I had expected a bit more for the price.",2024-06-13,0.2722222222222222,Positive
798,739,249,I'm very unhappy with this purchase. It didn't meet my expectations.,2023-11-30,-0.78,Negative
799,810,242,"It works, but I've had better products for the same price.",2023-09-10,0.25,Positive
800,458,229,"The product functions well, but I feel it could be improved in some areas.",2023-12-11,0.0,Neutral
801,672,216,"I can't say it's amazing, but it does what I need it to do.",2023-10-25,0.6000000000000001,Positive
802,811,226,This product is a game-changer. I'm so glad I bought it.,2024-06-18,0.5,Positive
803,236,220,I absolutely love this product! It exceeded my expectations in every way.,2023-11-01,0.625,Positive
804,444,253,Wonderful product! The quality and performance are unmatched.,2023-07-30,1.0,Positive
805,891,288,So impressed by the quality. This product truly delivers.,2023-09-13,1.0,Positive
806,486,292,I couldn't be happier with my purchase. It's perfect for what I needed.,2023-07-13,1.0,Positive
807,493,237,"It's functional, but I'm not blown away by it.",2024-04-20,0.0,Neutral
808,119,294,The quality and performance of this product are top-notch.,2023-10-13,1.0,Positive
809,866,214,It's sufficient for basic needs but could be better.,2023-12-08,0.25,Positive
810,754,296,The product arrived damaged and the customer service was terrible.,2024-04-07,-1.0,Negative
811,723,215,"Fantastic quality, and the performance is just amazing. Highly recommend!",2024-06-18,0.39999999999999997,Positive
812,424,290,Top-notch customer service and a reliable product. Great job!,2023-11-25,1.0,Positive
813,385,251,"Nothing to complain about, but nothing extraordinary either.",2023-11-02,0.3333333333333333,Positive
814,951,278,"It's an okay product, but there are some issues I have with it.",2023-10-07,0.5,Positive
815,344,297,I don't recommend this at all. It's not functional and doesn't last.,2023-07-17,0.0,Neutral
816,276,232,This is exactly what I was looking for. I'm so glad I bought it!,2023-08-13,0.4375,Positive
817,747,201,"Not bad, but there's room for improvement in some areas.",2023-12-20,0.3499999999999999,Positive
818,596,261,I regret buying this. The product is ineffective and badly made.,2023-09-11,-0.6999999999999998,Negative
819,661,252,"It works fine for now, but I'm not sure about its long-term durability.",2024-02-04,0.08333333333333334,Positive
820,490,252,"It's functional, but it's not a must-have product.",2023-10-07,0.0,Neutral
821,316,281,"I've been using this for a few weeks now, and it works flawlessly.",2024-06-12,0.4,Positive
822,734,273,"I thought this would be better, but it turned out to be a huge disappointment.",2024-01-10,0.09999999999999998,Positive
823,380,237,I absolutely love this product! It exceeded my expectations in every way.,2024-02-11,0.625,Positive
824,868,231,The quality is outstanding. I'm extremely impressed.,2023-10-25,0.75,Positive
825,908,208,"Not good at all. The quality is very poor, and I'm disappointed.",2023-11-17,-0.54,Negative
826,410,282,"Great design, easy to use, and it works wonderfully. Highly recommend!",2024-04-13,0.4777777777777778,Positive
827,977,228,"Excellent quality, great design, and super easy to use.",2023-07-08,0.6416666666666666,Positive
828,215,299,"I've used it a few times and it works, but it's not impressive.",2024-06-11,-0.35,Negative
829,238,279,"The customer service was fantastic, and the product arrived on time.",2023-12-06,0.4,Positive
830,434,220,This is hands down the best purchase I've made this year.,2023-09-09,0.4222222222222222,Positive
831,992,224,I've been using it for a while now and it's performing perfectly.,2024-06-19,1.0,Positive
832,804,280,"It works, but it doesn't feel like a high-end product.",2024-01-10,0.0,Neutral
833,234,201,"It's functional, but I'm not convinced it's the best choice for this price.",2023-11-19,1.0,Positive
834,555,252,Perfect fit for my needs. Will definitely order again.,2024-06-21,0.4666666666666666,Positive
835,191,273,Best investment I've made in a long time. Very happy with my purchase.,2023-08-09,0.65,Positive
836,577,298,The product does not match the description. Avoid this seller.,2023-12-03,0.0,Neutral
837,771,231,I've been using it for a while now and it's performing perfectly.,2023-07-06,1.0,Positive
838,994,252,So impressed by the quality. This product truly delivers.,2023-09-23,1.0,Positive
839,304,272,I'm amazed by how well it works. Great value for the price!,2024-06-19,1.0,Positive
840,647,275,This has made my life so much easier. I highly recommend it!,2024-06-10,0.2,Positive
841,147,285,Wonderful product! The quality and performance are unmatched.,2024-05-13,1.0,Positive
842,411,293,Perfect product for my needs! I can't imagine using anything else now.,2023-11-09,1.0,Positive
843,816,248,The quality is outstanding. I'm extremely impressed.,2024-04-17,0.75,Positive
844,530,248,Great product and excellent customer support. Totally worth it!,2024-06-15,0.725,Positive
845,870,224,The product is okay but nothing too special.,2024-03-16,0.4285714285714286,Positive
846,998,298,This is hands down the best purchase I've made this year.,2024-04-15,0.4222222222222222,Positive
847,784,279,"Nothing to complain about, but nothing extraordinary either.",2024-03-17,0.3333333333333333,Positive
848,903,245,"It works as advertised, but it's not particularly impressive.",2023-07-13,-0.5,Negative
849,677,286,This product is absolutely amazing. I'm recommending it to all my friends.,2024-04-02,0.6000000000000001,Positive
850,477,299,This product has exceeded all my expectations. Very satisfied.,2023-06-28,0.65,Positive
851,907,280,Very sleek design and works just as advertised. Love it!,2024-05-17,0.4125,Positive
852,186,211,I've had a wonderful experience with this product. Definitely recommend it!,2024-02-03,0.5,Positive
853,759,201,"I have mixed feelings. It's fine, but I was expecting a bit more.",2024-02-05,0.3055555555555556,Positive
854,314,251,"I have no complaints, but I don't have any praise for it either.",2023-06-27,0.0,Neutral
855,909,201,"The product is awful. It doesn't work as it should, and it's frustrating to use.",2024-05-12,-0.7,Negative
856,370,292,"I tried using it, but it's just not functional. Very frustrating.",2024-04-04,-0.52,Negative
857,277,205,Everything about this product is perfect. So happy with it!,2023-12-11,1.0,Positive
858,180,260,Very high-quality product. I would buy it again without hesitation.,2024-05-03,0.2,Positive
859,556,242,Worth every penny! Amazing quality and service.,2024-06-01,0.48750000000000004,Positive
860,499,206,Terrible experience. The product doesn't perform well at all.,2023-07-23,-1.0,Negative
861,459,287,This is hands down the best purchase I've made this year.,2023-07-05,0.4222222222222222,Positive
862,366,208,"The product is decent, but I've come across better quality.",2024-01-10,0.3333333333333333,Positive
863,546,248,"I had high hopes for this, but it was a total letdown.",2023-10-26,0.08,Positive
864,591,232,It broke within a few days of use. Terrible quality!,2024-02-25,-0.6,Negative
865,812,212,The quality and performance of this product are top-notch.,2024-04-29,1.0,Positive
866,765,289,This product is a game-changer. I'm so glad I bought it.,2023-09-30,0.5,Positive
867,277,205,I've had a wonderful experience with this product. Definitely recommend it!,2023-07-04,0.5,Positive
868,617,289,"It's acceptable, but I don't have any strong feelings about it.",2024-01-24,0.43333333333333335,Positive
869,518,204,"I tried using it, but it's just not functional. Very frustrating.",2023-06-27,-0.52,Negative
870,260,291,Excellent quality and fast shipping. Very happy with it.,2024-01-14,0.7333333333333334,Positive
871,740,208,I regret buying this. The product is ineffective and badly made.,2024-05-14,-0.6999999999999998,Negative
872,163,266,I don't recommend this at all. It's not functional and doesn't last.,2023-07-01,0.0,Neutral
873,826,203,I've had better products for less money. This one is definitely not worth it.,2024-03-29,0.06111111111111112,Positive
874,902,259,"The product is okay, just nothing special to make it stand out.",2023-10-07,0.4285714285714286,Positive
875,796,296,I've been using it for a while now and it's performing perfectly.,2023-12-07,1.0,Positive
876,569,242,This product has exceeded all my expectations. Very satisfied.,2023-10-18,0.65,Positive
877,523,230,"It works well, but there's nothing exciting about it.",2023-07-19,0.3,Positive
878,508,294,Everything about this product is great! It works as advertised and more.,2023-07-26,0.75,Positive
879,167,256,I am extremely satisfied with my purchase. Worth every penny!,2023-10-29,0.4375,Positive
880,493,226,"It's fine, but it doesn't exceed the expectations set by the description.",2023-09-14,0.4166666666666667,Positive
881,123,296,I absolutely love this! It's even better than I expected.,2024-02-08,0.3416666666666666,Positive
882,458,247,Terrible experience. The product doesn't perform well at all.,2023-12-10,-1.0,Negative
883,747,208,"It's okay overall, but I expected a bit more based on the reviews.",2024-05-09,0.225,Positive
884,629,259,"The product arrived on time, but it's just alright.",2023-06-30,0.0,Neutral
885,302,231,The product does exactly what it's supposed to do. Very happy.,2024-05-20,0.625,Positive
886,375,204,"I was expecting something better, but this product is just average.",2023-10-29,0.175,Positive
887,941,267,This product has made my daily routine so much easier. Highly recommend.,2023-08-16,0.12,Positive
888,772,257,I'm frustrated with this product. It's not what I hoped for at all.,2023-10-14,-0.7,Negative
889,258,222,"I love this item. It's sturdy, functional, and well-made.",2023-09-29,0.5,Positive
890,686,246,"It broke within a few days of use, and customer service didn't help at all.",2023-10-18,-0.2,Negative
891,656,278,It's easy to use and super efficient. I'm so glad I bought it.,2023-11-29,0.4222222222222222,Positive
892,551,250,"It's acceptable, but I don't have any strong feelings about it.",2023-06-28,0.43333333333333335,Positive
893,481,256,"The instructions were unclear, and it doesn't work as advertised.",2023-10-06,0.0,Neutral
894,493,292,"Fantastic quality, and the performance is just amazing. Highly recommend!",2024-02-17,0.39999999999999997,Positive
895,970,277,"It works, but it doesn't feel like a high-end product.",2023-12-21,0.0,Neutral
896,891,256,I can't believe I wasted my money on this. It's not worth it.,2024-06-09,-0.175,Negative
897,577,268,"It's not bad, but I wouldn't say it's great either.",2024-04-16,0.575,Positive
898,490,263,Wonderful product! The quality and performance are unmatched.,2023-10-17,1.0,Positive
899,716,285,Fantastic experience from start to finish. Highly recommend!,2024-05-10,0.30000000000000004,Positive
900,492,255,The product is just fine. Doesn't stand out in any way.,2023-11-24,0.4166666666666667,Positive
901,633,298,This product is a game-changer. I'm so glad I bought it.,2023-10-06,0.5,Positive
902,553,240,The product is functional but doesn't offer anything exciting.,2024-02-16,0.3,Positive
903,286,241,Very disappointing. I expected much more for the price I paid.,2023-08-14,-0.12666666666666668,Negative
904,682,222,"Not bad, but there's room for improvement in some areas.",2024-05-11,0.3499999999999999,Positive
905,805,298,I've never been this satisfied with a purchase before.,2023-11-21,0.5,Positive
906,950,211,"Not bad, but there's room for improvement in some areas.",2023-08-17,0.3499999999999999,Positive
907,733,260,"I was hoping for something better, but this item is completely useless.",2024-03-01,0.0,Neutral
908,768,223,Completely useless. It doesn't do what it says on the box.,2023-09-09,-0.5,Negative
909,555,217,"I don't hate it, but I don't love it either. It's just average.",2023-07-31,-0.15000000000000002,Negative
910,465,296,"It's a decent product, but it doesn't offer the best value for the price.",2024-04-20,0.5833333333333334,Positive
911,891,209,I'm really impressed with the quality and the results. 10/10!,2024-04-21,1.0,Positive
912,107,240,"I can't say it's amazing, but it does what I need it to do.",2024-05-13,0.6000000000000001,Positive
913,953,275,The product functions as expected but isn't remarkable.,2023-07-27,0.325,Positive
914,594,225,This has made my life so much easier. I highly recommend it!,2024-06-17,0.2,Positive
915,677,220,"It's an okay product, but there are some issues I have with it.",2023-12-17,0.5,Positive
916,120,250,Everything about this product is perfect. So happy with it!,2023-09-20,1.0,Positive
917,943,225,I've never been this satisfied with a purchase before.,2024-05-31,0.5,Positive
918,723,215,"It works so well, and it's exactly what I needed for my project.",2024-01-11,0.25,Positive
919,910,207,"It's good enough to keep, but I'm not excited about it.",2023-09-25,0.1708333333333333,Positive
920,443,207,I couldn't be more pleased with this purchase. It works perfectly!,2024-06-10,0.6666666666666666,Positive
921,682,252,This product is absolutely amazing. I'm recommending it to all my friends.,2023-08-10,0.6000000000000001,Positive
922,777,229,"The product is good for the price, but there are some minor flaws.",2023-10-17,0.32499999999999996,Positive
923,646,241,The product functions as expected but isn't remarkable.,2024-01-08,0.325,Positive
924,367,278,"It's okay overall, but I expected a bit more based on the reviews.",2023-10-21,0.225,Positive
925,598,298,I've never been this satisfied with a purchase before.,2023-07-14,0.5,Positive
926,470,218,"It works, but I've had better products for the same price.",2023-08-13,0.25,Positive
927,703,231,"The product is decent, but I've come across better quality.",2023-10-06,0.3333333333333333,Positive
928,585,202,Worth every penny! Amazing quality and service.,2024-05-10,0.48750000000000004,Positive
929,763,284,Great performance and easy to use. I'm very satisfied with this product.,2024-03-22,0.6277777777777778,Positive
930,439,219,"It's fine for casual use, but I wouldn't use it for anything heavy.",2023-07-21,-0.09444444444444444,Negative
931,220,279,Completely useless. It doesn't do what it says on the box.,2023-09-15,-0.5,Negative
932,892,232,The product does exactly what it's supposed to do. Very happy.,2023-07-03,0.625,Positive
933,528,240,This is exactly what I was looking for. I'm so glad I bought it!,2024-05-13,0.4375,Positive
934,331,283,This product does exactly what I wanted it to do. Very pleased.,2024-03-16,0.45,Positive
935,100,218,This product does exactly what I wanted it to do. Very pleased.,2024-03-27,0.45,Positive
936,180,209,Excellent quality and fast shipping. Very happy with it.,2024-04-10,0.7333333333333334,Positive
937,488,273,Impressed with the durability and performance of this product.,2024-06-10,1.0,Positive
938,747,254,"This item is exactly as described, and it works beautifully!",2024-02-06,0.625,Positive
939,672,298,Everything about this product is great! It works as advertised and more.,2023-12-18,0.75,Positive
940,222,228,I couldn't be happier with my purchase. It's perfect for what I needed.,2023-10-28,1.0,Positive
941,178,258,This product didn't work as expected. It's unreliable and frustrating.,2023-08-16,-0.25,Negative
942,577,256,Such a fantastic product at a great price. Worth every cent!,2023-12-18,0.39375000000000004,Positive
943,459,294,Very high-quality product. I would buy it again without hesitation.,2024-06-09,0.2,Positive
944,518,207,I absolutely love this product! It exceeded my expectations in every way.,2024-06-10,0.625,Positive
945,943,212,"The product is okay, just nothing special to make it stand out.",2023-08-27,0.4285714285714286,Positive
946,768,229,"The product is fine, but it lacks the features I was hoping for.",2023-11-22,0.4166666666666667,Positive
947,393,285,The product is exactly what I was hoping for. I'm very satisfied.,2023-07-20,0.45,Positive
948,430,213,"This item is exactly as described, and it works beautifully!",2023-11-19,0.625,Positive
949,591,284,"It's functional, but I'm not convinced it's the best choice for this price.",2024-01-09,1.0,Positive
950,791,242,"It broke within a few days of use, and customer service didn't help at all.",2023-09-25,-0.2,Negative
951,627,262,"It works so well, and it's exactly what I needed for my project.",2023-10-14,0.25,Positive
952,504,226,"The product does its job, but I expected something more impressive.",2024-01-26,0.4666666666666666,Positive
953,265,207,"It broke within a few days of use, and customer service didn't help at all.",2023-08-24,-0.2,Negative
954,262,294,Overpriced for what it offers. Very unhappy with my purchase.,2023-08-23,-0.34,Negative
955,950,274,This product has made my daily routine so much easier. Highly recommend.,2024-02-08,0.12,Positive
956,581,212,I've never been this satisfied with a purchase before.,2023-07-04,0.5,Positive
957,460,295,"It does the job, but I wasn't impressed by its performance.",2024-04-03,1.0,Positive
958,678,249,I regret buying this. Save your money and look elsewhere.,2023-07-28,0.0,Neutral
959,717,257,"The customer service was fantastic, and the product arrived on time.",2023-07-11,0.4,Positive
960,340,272,The best product I've used in a long time. Kudos to the team!,2024-02-01,0.46875,Positive
961,497,295,Very sleek design and works just as advertised. Love it!,2024-03-21,0.4125,Positive
962,148,274,The quality is outstanding. I'm extremely impressed.,2023-12-27,0.75,Positive
